{
  "$schema": "https://json-schema.org/draft/2020-12/schema",
  "$id": "https://finger-light/lightscore-v1.schema.json",
  "title": "Light-score v1",
  "description": "The compiled artifact the PC-side score compiler (Part 3) writes and the Pi-side firmware (Part 2) plays back. Device-independent: it carries musical facts only. LED indices are NOT stored here -- the firmware derives them from its own calibrated note map, so one light-score plays on any bar.",
  "type": "object",
  "required": ["format", "version", "notes"],
  "additionalProperties": false,
  "properties": {
    "format": { "const": "lightscore" },
    "version": { "const": 1 },

    "meta": {
      "type": "object",
      "additionalProperties": true,
      "properties": {
        "title": { "type": "string" },
        "source": {
          "description": "Which input arm produced this: a MIDI file, MusicXML, OMR over a PDF/photo, or audio transcription.",
          "enum": ["midi", "musicxml", "omr", "audio"]
        },
        "source_file": { "type": "string" },
        "generator": { "type": "string" },
        "generated_at": { "type": "string", "format": "date-time" },
        "fingering": {
          "description": "How the fingering was produced. 'dp' = generated by the fingering DP; 'score' = taken from fingering marks already in the source; 'manual' = hand-edited.",
          "enum": ["dp", "score", "manual", "mixed"]
        },
        "fingering_cost": {
          "type": "number",
          "description": "Total DP path cost. Useful for regression-testing the cost model across releases; not used at playback."
        }
      }
    },

    "tempo": {
      "description": "Tempo map, for display and for re-deriving beats. Playback does NOT need it: every note already carries absolute milliseconds.",
      "type": "array",
      "items": {
        "type": "object",
        "required": ["t", "bpm"],
        "additionalProperties": false,
        "properties": {
          "t":   { "type": "integer", "minimum": 0, "description": "ms from start" },
          "bpm": { "type": "number", "exclusiveMinimum": 0 }
        }
      }
    },

    "notes": {
      "description": "Every note, sorted by onset t ascending. Short keys are deliberate: a dense piece is tens of thousands of notes and this is parsed on a 512 MB Pi Zero 2 W.",
      "type": "array",
      "items": {
        "type": "object",
        "required": ["t", "d", "p", "h", "f"],
        "additionalProperties": false,
        "properties": {
          "t": { "type": "integer", "minimum": 0,
                 "description": "Onset, ms from start." },
          "d": { "type": "integer", "exclusiveMinimum": 0,
                 "description": "Duration, ms." },
          "p": { "type": "integer", "minimum": 21, "maximum": 108,
                 "description": "MIDI pitch. Bounded to the 88-key range A0..C8 -- anything outside cannot be shown on the bar." },
          "h": { "enum": ["L", "R"],
                 "description": "Hand. Drives the left pixel of the 2-LED pair (D-12)." },
          "f": { "type": "integer", "minimum": 1, "maximum": 5,
                 "description": "Finger, 1=thumb .. 5=little. Drives the right pixel's hue (D-12). This is the whole point of the format." },
          "stf": { "type": "integer", "minimum": 1,
                   "description": "Originating staff, 1=top. Display only; hand assignment lives in h." },
          "v": { "type": "integer", "minimum": 0, "maximum": 127,
                 "description": "Velocity, if the source had one." }
        }
      }
    }
  }
}
