{
 "format": "lightscore",
 "version": 1,
 "notes": [
  {
   "t": 0,
   "d": 2000,
   "p": 48,
   "h": "L",
   "f": 1,
   "stf": 2
  },
  {
   "t": 0,
   "d": 2000,
   "p": 57,
   "h": "R",
   "f": 1,
   "stf": 1
  },
  {
   "t": 0,
   "d": 500,
   "p": 60,
   "h": "R",
   "f": 2,
   "stf": 1
  },
  {
   "t": 500,
   "d": 500,
   "p": 64,
   "h": "R",
   "f": 4,
   "stf": 1
  },
  {
   "t": 1000,
   "d": 1000,
   "p": 67,
   "h": "R",
   "f": 5,
   "stf": 1
  },
  {
   "t": 2000,
   "d": 4000,
   "p": 43,
   "h": "L",
   "f": 3,
   "stf": 2
  },
  {
   "t": 2000,
   "d": 2000,
   "p": 60,
   "h": "R",
   "f": 2,
   "stf": 1
  },
  {
   "t": 4000,
   "d": 2000,
   "p": 62,
   "h": "R",
   "f": 3,
   "stf": 1
  }
 ],
 "meta": {
  "source": "musicxml",
  "source_file": "score/tests/fixtures/hard.musicxml",
  "title": "Hard study (compiler fixture)",
  "fingering": "dp"
 },
 "tempo": [
  {
   "t": 0,
   "bpm": 120.0
  },
  {
   "t": 2000,
   "bpm": 60.0
  }
 ]
}
